{
  "$schema": "https://json-schema.org/draft/2020-12/schema",
  "$id": "https://moolam.ai/schemas/bindings-vision.cbse-worksheet.v1.json",
  "title": "CBSE worksheet layout extraction",
  "description": "VisionInterface responseSchema for a single photographed CBSE-style worksheet page. Nullable fields mean illegible/unknown — never invent grades or marks. Single page only (pageIndex must be 0).",
  "schemaVersion": "bindings-vision.cbse-worksheet.v1",
  "type": "object",
  "additionalProperties": false,
  "required": [
    "schemaVersion",
    "documentKind",
    "pageIndex",
    "confidence",
    "items",
    "partial"
  ],
  "properties": {
    "schemaVersion": {
      "type": "string",
      "const": "bindings-vision.cbse-worksheet.v1"
    },
    "documentKind": {
      "type": "string",
      "const": "cbse-worksheet"
    },
    "board": {
      "type": ["string", "null"],
      "description": "Exam board when readable (e.g. CBSE); null when unknown."
    },
    "classLevel": {
      "type": ["string", "null"],
      "description": "Class/grade band when readable (e.g. Class 8); null when unknown."
    },
    "subject": {
      "type": ["string", "null"],
      "description": "Subject label when readable; null when unknown."
    },
    "title": {
      "type": ["string", "null"],
      "description": "Worksheet title when readable; null when unknown."
    },
    "pageIndex": {
      "type": "integer",
      "const": 0,
      "description": "Caller passes one page image; multi-image batches are rejected by the document path."
    },
    "confidence": {
      "type": "number",
      "minimum": 0,
      "maximum": 1,
      "description": "Overall extraction confidence (field-level confidences live on items)."
    },
    "items": {
      "type": "array",
      "maxItems": 64,
      "description": "Bounded question/response rows; empty when nothing readable.",
      "items": {
        "type": "object",
        "additionalProperties": false,
        "required": ["index", "confidence"],
        "properties": {
          "index": {
            "type": "integer",
            "minimum": 1,
            "maximum": 64
          },
          "promptText": {
            "type": ["string", "null"],
            "description": "Printed/handwritten prompt; null when illegible."
          },
          "learnerResponse": {
            "type": ["string", "null"],
            "description": "Learner answer text; null when blank or illegible."
          },
          "marksAllocated": {
            "type": ["number", "null"],
            "description": "Printed marks for the item; null when absent/illegible — never invent."
          },
          "marksAwarded": {
            "type": ["number", "null"],
            "description": "Awarded marks when marked on the page; null when unmarked/illegible — never invent grades."
          },
          "confidence": {
            "type": "number",
            "minimum": 0,
            "maximum": 1
          }
        }
      }
    },
    "partial": {
      "type": "boolean",
      "description": "true when extraction is incomplete (low resolution, crop, or unresolved fields)."
    },
    "unresolvedFields": {
      "type": "array",
      "maxItems": 64,
      "items": { "type": "string", "minLength": 1, "maxLength": 128 },
      "description": "Dotted paths for fields left unknown without hallucination."
    }
  }
}

